{
  "schema_version": "technical-probe/v1",
  "asset_id": "asset_video_local_001",
  "sha256": "sha256:ffffffffffffffffffffffffffffffffffffffffffffffffffffffffffffffff",
  "bytes": 4281940,
  "container": "mp4",
  "duration_ms": 33000,
  "total_frames": 990,
  "video": {
    "codec": "h264",
    "pixel_format": "yuv420p",
    "width": 1920,
    "height": 1080,
    "fps_num": 30,
    "fps_den": 1,
    "start_ms": 0
  },
  "audio": {
    "codec": "aac",
    "sample_rate_hz": 48000,
    "channels": 1,
    "start_ms": 0
  },
  "stream_counts": {"video": 1, "audio": 1, "subtitle": 0, "data": 0},
  "av_drift_ms": 0,
  "decode_ok": true,
  "loudness": {
    "profile": "voiceover-minus16lufs-v1",
    "normalized": true,
    "input_integrated_lufs": -21.4,
    "input_true_peak_dbtp": -4.7,
    "output_integrated_lufs": -16.0,
    "output_true_peak_dbtp": -2.1
  },
  "tools": {
    "ffmpeg_version": "8.1.1",
    "ffprobe_version": "8.1.1",
    "filtergraph_sha256": "sha256:1111111111111111111111111111111111111111111111111111111111111111"
  }
}
